name,meshid,meshname,scope
cystic fibrosis,D003550,Cystic Fibrosis,"An autosomal recessive genetic disease of the EXOCRINE GLANDS. It is caused by mutations in the gene encoding the CYSTIC FIBROSIS TRANSMEMBRANE CONDUCTANCE
REGULATOR expressed in several organs including the LUNG, the PANCREAS, the
BILIARY SYSTEM, and the SWEAT GLANDS. Cystic fibrosis is characterized by
epithelial secretory dysfunction associated with ductal obstruction resulting in 
AIRWAY OBSTRUCTION; chronic RESPIRATORY INFECTIONS; PANCREATIC INSUFFICIENCY;
maldigestion; salt depletion; and HEAT PROSTRATION.
Year introduced: 1967"
sarcoidosis,D012507,Sarcoidosis,"An idiopathic systemic inflammatory granulomatous disorder comprised of epithelioid and multinucleated giant cells with little necrosis. It usually
invades the lungs with fibrosis and may also involve lymph nodes, skin, liver,
spleen, eyes, phalangeal bones, and parotid glands.
Year introduced: PSEUDOTUBERCULOSIS use SARCOIDOSIS 1963-1992"
