title,citation,year,pmid
A review of the volatiles from the healthy human body.,J Breath Res 2014 Mar;8(1):014001.,2014,24421258
Blood volatile compounds as biomarkers for colorectal cancer.,Cancer Biol. Ther. 2014 Feb;15(2):200-6.,2014,24100612
[Association of indoor air quality with physical health of users in a newly built school building in a university].,Nihon Eiseigaku Zasshi 2011 Jan;66(1):122-8.,2011,21358143
Acute effects of exposure to 1 mg/m(3) of vaporized 2-ethyl-1-hexanol in humans.,Indoor Air 2010 Apr;20(2):168-75.,2010,20409194
"Annual transition and seasonal variation of indoor air pollution levels of 2-ethyl-1-hexanol in large-scale buildings in Nagoya, Japan.",J Environ Monit 2009 Nov;11(11):2068-76.,2009,19890564
[Investigation of air pollution in a shopping center and employees' personal exposure level].,Nihon Eiseigaku Zasshi 2008 Jan;63(1):20-8.,2008,18306654
Experimental PVC material challenge in subjects with occupational PVC exposure.,Environ. Health Perspect. 2006 Sep;114(9):1409-13.,2006,16966097
Nasal lavage biomarkers: effects of water damage and microbial growth in an office building.,Arch. Environ. Health 2001 Jan-Feb;56(1):30-6.,,11256854
