title,citation,year,pmid
Evaluation and modeling of the impact of coexposures to VOC mixtures on urinary biomarkers.,Inhal Toxicol 2016 ;28(6):260-73.,2016,27053005
A review of the volatiles from the healthy human body.,J Breath Res 2014 Mar;8(1):014001.,2014,24421258
Surface acoustic wave (SAW) microsensor array for measuring VOCs in drinking water.,J Environ Monit 2006 Sep;8(9):932-41.,2006,16951753
Exposure to volatile organic compounds in residences adjacent to dyeing industrial complex.,Int Arch Occup Environ Health 2004 Feb;77(2):113-20.,2004,14648131
Secretion of proinflammatory eicosanoid-like substances precedes allergen release from pollen grains in the initiation of allergic sensitization.,Int. Arch. Allergy Immunol. 2001 Jan-Mar;124(1-3):121-5.,,11306946
