title,citation,year,pmid
Biomarker Profiles in Asthma With High vs Low Airway Reversibility and Poor Disease Control.,Chest 2015 Dec;148(6):1489-1496.,2015,26226215
"Prostaglandin D₂ pathway upregulation: relation to asthma severity, control, and TH2 inflammation.",J. Allergy Clin. Immunol. 2013 Jun;131(6):1504-12.,2013,23506843
Lipid metabolite levels of prostaglandin D2 and eicosapentaenoic acid recovered from bronchoalveolar lavage fluid correlate with lung function of chronic obstructive pulmonary disease patients and controls.,Electrophoresis 2009 Apr;30(7):1228-34.,2009,19294692
"Effects of a thromboxane-receptor antagonist, BAY u 3405, on prostaglandin D2- and exercise-induced bronchoconstriction.",J. Allergy Clin. Immunol. 1992 Jun;89(6):1119-26.,1992,1535083
"Nasal challenge with cold, dry air results in release of inflammatory mediators. Possible mast cell involvement.",J. Clin. Invest. 1985 Oct;76(4):1375-81.,1985,2414318
