title,citation,year,pmid
Volatile Organic Compounds in Exhaled Breath of Idiopathic Pulmonary Fibrosis for Discrimination from Healthy Subjects.,Lung 2017 04;195(2):247-254.,2017,28247041
A review of the volatiles from the healthy human body.,J Breath Res 2014 Mar;8(1):014001.,2014,24421258
Investigation of urinary volatile organic metabolites as potential cancer biomarkers by solid-phase microextraction in combination with gas chromatography-mass spectrometry.,Br. J. Cancer 2011 Dec;105(12):1894-904.,2011,22085842
Characterisation of odorants emissions from landfills by SPME and GC/MS.,Chemosphere 2003 May;51(5):357-68.,2003,12598001
Occurrence of organic pollutants in recovered soil fines from construction and demolition waste.,Waste Manag 2001 ;21(8):703-15.,2001,11699628
